{
  "enabled": true,
  "storageEnabled": true,
  "schedulerDelayMs": 1000,
  "dueBatchSize": 20,
  "statusBatchSize": 30,
  "defaultIntervalSeconds": 300,
  "minIntervalSeconds": 1,
  "maxIntervalSeconds": 2592000,
  "shortIntervalWarningSeconds": 120,
  "failureBackoffSeconds": 900,
  "requestMinIntervalMs": 1500,
  "maxAttempts": 3,
  "retryBackoffMs": 1500,
  "connectTimeoutMs": 5000,
  "readTimeoutMs": 10000,
  "userAgent": "SocialDataMonitor/0.1 (+low-frequency public Bilibili live monitor)",
  "referer": "https://live.bilibili.com/"
}
